id,title,authors,venue,year
1625,the generalized mdl approach for summarization,"laks v. s. lakshmanan , xiaodong zhou , raymond t. ng , theodore johnson , christine xing wang",vldb,2002
1626,view invalidation for dynamic content caching in multitiered architectures,"k. selçuk candan , wang-pin hsiung , oliver po , divyakant agrawal , wen-syan li",vldb,2002
1630,sensor : the atomic computing particle,vijay kumar,sigmod record,2003
1631,optimization of queries with user-defined predicates,"surajit chaudhuri , kyuseok shim",vldb,1996
1637,instance-based attribute identification in database integration,"roger h. l. chiang , ee-peng lim , chua eng huang cecil",vldb j.,2003
1651,exploiting statistics on query expressions for optimization,"nicolas bruno , surajit chaudhuri",sigmod conference,2002
1656,mining system audit data : opportunities and challenges,"wei fan , wenke lee",sigmod record,2001
1659,the medusa project : autonomous data management in a shared-nothing parallel database machine,"george m. bryan , j. geyer , wayne e. moore , b. j. curry , k. w. lodge",sigmod conference,1994
1665,objects and sql : strange relations ? panel,donald r. deutsch,sigmod conference,1995
1669,"active storage hierarchy , database systems and applications - socratic exegesis","joel h. saltz , john burgess , felipe cariño , william o'connell",vldb,1999
1674,xml and information retrieval : a sigir 2000 workshop,"yoëlle s. maarek , david carmel , aya soffer",sigmod record,2001
1682,tutorial : data access,"anand deshpande , josé a. blakeley",sigmod conference,2000
1692,the lyric language : querying constraint objects,"alexander brodsky , yoram kornatzky",sigmod conference,1995
1703,quadtree and r-tree indexes in oracle spatial : a comparison using gis data,"kothuri venkata ravi kanth , siva ravada , daniel abugov",sigmod conference,2002
1712,the infosleuth project,"marek rusinkiewicz , tomasz ksiezyk , richard s. brice , ray shea , vipul kashyap , andrzej cichocki , mosfeq rashid , c. unnikrishnan , abdelsalam helal , amy unruh , marian h. nodine , jerry fowler , darrell woelk , gale martin , roberto j. bayardo jr. , william bohrer",sigmod conference,1997
1719,"gio wiederhold speaks out on moving into academia in mid-career , how to be an effective consultant , why you should be a program manager as a funding agency , the need for ontology algebra and simulations , and more",marianne winslett,sigmod record,2001
1722,nearest neighbor queries,"stephen kelley , frédéic vincent , nick roussopoulos",sigmod conference,1995
1735,"preference sql - design , implementation , experiences","gerhard köstler , werner kießling",vldb,2002
1742,improving performance with bulk-inserts in oracle r-trees,"ning an , siva ravada , kothuri venkata ravi kanth",vldb,2003
1747,minicon : a scalable algorithm for answering queries using views,"rachel pottinger , alon y. halevy",vldb j.,2001
1769,a scalable hash ripple join algorithm,"peter j. haas , jeffrey f. naughton , gang luo , curt ellmann",sigmod conference,2002
1772,the design and implementation of k : a high-level knowledge-base programming language of osam * . kbms,"stanley y. w. su , javier arroyo , herman lam , yuh-ming shyy",vldb j.,1996
1783,exchanging intensional xml data,"omar benjelloun , tova milo , serge abiteboul , frederic dang ngoc , bernd amann",sigmod conference,2003
1789,fast evaluation techniques for complex similarity queries,"michael mlivoncic , roger weber , klemens böhm , hans-jörg schek",vldb,2001
1799,structures for manipulating proposed updates in object-oriented databases,"richard hull , mohammed rupawalla , michael doherty",sigmod conference,1996
1805,an extensible notation for spatiotemporal index queries,"richard t. snodgrass , vassilis j. tsotras , christian s. jensen",sigmod record,1998
1815,integrating heterogenous overlapping databases through object-oriented transformations,"tore risch , vanja josifovski",vldb,1999
1817,investigating xquery for querying across database object types,nancy wiegand,sigmod record,2002
1826,implementing abstract objects with inheritance in datalogneg,hasan m. jamil,vldb,1997
1835,wavelet-based histograms for selectivity estimation,"jeffrey scott vitter , yossi matias , min wang",sigmod conference,1998
1850,efficient and effective clustering methods for spatial data mining,"raymond t. ng , jiawei han",vldb,1994
1852,a scalable architecture for autonomous heterogeneous database interactions,"athman bouguettaya , steven milliner , mike p. papazoglou",vldb,1995
1853,a logical framework for scheduling workflows under resource allocation constraints,"michael kifer , pinar senkul , ismail h. toroslu",vldb,2002
1857,bringing order to query optimization,"giedrius slivinskas , richard t. snodgrass , christian s. jensen",sigmod record,2002
1864,containment join size estimation : models and methods,"haifeng jiang , hongjun lu , wei wang , jeffrey xu yu",sigmod conference,2003
1866,databases and visualization,daniel a. keim,sigmod conference,1996
1880,devise : integrated querying and visual exploration of large datasets ( demo abstract ),"jussi myllymaki , shilpa lawande , donko donjerkovic , raghu ramakrishnan , guangshun chen , kevin s. beyer , miron livny , r. kent wenger",sigmod conference,1997
1883,xcache : a semantic caching system for xml queries,"elke a. rundensteiner , song wang , li chen",sigmod conference,2002
1884,cover your assets,michael a. olson,sigmod conference,1995
1894,reasoning on regular path queries,"giuseppe de giacomo , moshe y. vardi , maurizio lenzerini , diego calvanese",sigmod record,2003
1898,an online video placement policy based on bandwith to space ratio ( bsr ),"dinkar sitaram , asit dan",sigmod conference,1995
1905,editor 's notes,arie segev,sigmod record,1994
1914,reminiscences on influential papers,"jan van den bussche , surajit chaudhuri , moshe y. vardi , kenneth a. ross , gösta grahne , h. v. jagadish",sigmod record,1999
1921,an extendible hash for multi-precision similarity querying of image databases,"m. tamer özsu , shu lin , raymond t. ng , vincent oria",vldb,2001
1943,interaction of query evaluation and buffer management for information retrieval,"björn þór jónsson , divesh srivastava , michael j. franklin",sigmod conference,1998
1964,the samos active dbms prototype,"klaus r. dittrich , stella gatziu , andreas geppert",sigmod conference,1995
1967,supporting efficient multimedia database exploration,"k. selçuk candan , yoshinori hara , kyoji hirata , wen-syan li",vldb j.,2001
1974,iceberg-cube computation with pc clusters,"yu yin , raymond t. ng , alan s. wagner",sigmod conference,2001
1984,influencing database language standards,leonard gallagher,sigmod record,1994
1985,static detection of security flaws in object-oriented databases,keishi tajima,sigmod conference,1996
2000,retrieval of composite multimedia objects,"surajit chaudhuri , shahram ghandeharizadeh , cyrus shahabi",vldb,1995
2004,unix rdbms : the next generation,bill rosneblatt,sigmod record,1994
2019,workshop report on experiences using object data management in the real-world,akmal b. chaudhri,sigmod record,1998
2024,wsq/dsq : a practical approach for combined querying of databases and the web,"roy goldman , jennifer widom",sigmod conference,2000
2025,netcube : a scalable tool for fast data mining and compression,"dimitris margaritis , christos faloutsos , sebastian thrun",vldb,2001
2028,detection and classification of intrusions and faults using sequences of system calls,"joão b. d. cabrera , raman k. mehra , lundy m. lewis",sigmod record,2001
2040,statistical synopses for graph-structured xml databases,"minos n. garofalakis , neoklis polyzotis",sigmod conference,2002
2043,sleepers and workaholics : caching strategies in mobile environments,"daniel barbará , tomasz imielinski",sigmod conference,1994
2046,versioning and configuration management in an object-oriented data model,edward sciore,vldb j.,1994
2047,"adaptive , hands-off stream mining","anthony brockwell , spiros papadimitriou , christos faloutsos",vldb,2003
2050,"storhouse metanoia - new applications for database , storage & data warehousing","felipe cariño , pekka kostamaa , art kaufmann , john burgess",sigmod conference,2001
2062,optimizing multiple dimensional queries simultaneously in multidimensional databases,"jeffrey xu yu , weifa liang , maria e. orlowska",vldb j.,2000
2070,integrated data management for mobile services in the real world,"igor timko , torben bach pedersen , christian hage , christian s. jensen , laurynas speicys",vldb,2003
2072,a transaction replication scheme for a replicated database with node autonomy,"david wai-lok cheung , ada wai-chee fu",vldb,1994
2075,t2 : a customizable parallel database for multi-dimensional data,"alan sussman , anurag acharya , joel h. saltz , chialin chang",sigmod record,1998
2088,partition selection policies in object database garbage collection,"benjamin g. zorn , alexander l. wolf , jonathan e. cook",sigmod conference,1994
2100,building a laboratory information system around a c++ - based object-oriented dbms,"nathan goodman , steve rozen , lincoln stein",vldb,1994
2102,querying continuous time sequences,"tore risch , ling lin",vldb,1998
2118,query processing techniques for multiversion access methods,"jochen van den bercken , bernhard seeger",vldb,1996
2120,"information , communication , and money : for what can we charge and how can we meter it ?","henry f. korth , stephen blott , abraham silberschatz",vldb,1998
2128,rainbow : multi-xquery optimization using materialized xml views,"brian murphy , elke a. rundensteiner , bradford pielech , maged el-sayed , mukesh mulchandani , luping ding , katica dimitrova , ling wang , xin zhang",sigmod conference,2003
2136,dyda : data warehouse maintenance in fully concurrent environments,"songting chen , andreas koeller , elke a. rundensteiner , xin zhang , jun chen",sigmod conference,2001
2137,processing sliding window multi-joins in continuous queries over data streams,"lukasz golab , m. tamer özsu",vldb,2003
2144,database principles column - introduction,leonid libkin,sigmod record,1999
2153,garlic : a new flavor of federated query processing for db2,"peter m. schwarz , laura m. haas , vanja josifovski , eileen tien lin",sigmod conference,2002
2159,the microsoft repository,"david shutt , jason zander , brian harry , paul sanders , philip a. bernstein",vldb,1997
2174,a critique of ansi sql isolation levels,"philip a. bernstein , patrick e. o'neil , hal berenson , elizabeth j. o'neil , jim melton , jim gray",sigmod conference,1995
2179,opt + + : an object-oriented implementation for extensible database query optimization,"david j. dewitt , navin kabra",vldb j.,1999
2201,the oracle universal server buffer,"ashok joshi , n. macnaughton , juan loaiza , m. keihl , tirthankar lahiri , william bridge",vldb,1997
2218,the n-tier hub technology,"rainer a. sommer , david bailey , thomas r. gulledge",sigmod record,2002
2227,warping indexes with envelope transforms for query by humming,"dennis shasha , yunyue zhu",sigmod conference,2003
2234,scientific olap for the biotech domain,nam huyn,vldb,2001
2236,evaluating probabilistic queries over imprecise data,"reynold cheng , dmitri v. kalashnikov , sunil prabhakar",sigmod conference,2003
2240,new tpc benchmarks for decision support and web commerce,"meikel pöss , chris floyd",sigmod record,2000
2242,distributed top-n query processing with possibly uncooperative local systems,"clement t. yu , weiyi meng , george philip",vldb,2003
2252,building and customizing data-intensive web sites using weave,"valérie issarny , patrick valduriez , khaled yagoub , daniela florescu",vldb,2000
2256,databases and workflow management : what is it all about ? ( panel ),"jim gray , betty salzberg , stefano ceri , andreas reuter , gerhard weikum",vldb,1995
2258,quotient cube : how to summarize the semantics of a data cube,"laks v. s. lakshmanan , jian pei , jiawei han",vldb,2002
2278,changing the rules : transformations for rule-based optimizers,"mitch cherniack , stanley b. zdonik",sigmod conference,1998
2285,mid-tier caching : the timesten approach,times-ten team,sigmod conference,2002
2290,florida international university high performance database research center,"leonard loureiro , yi deng , carlos ordonez 0002 , mario sanchez , cyril u. orji , wei sun , artyom shaposhnikov , naphtali rishe , michael alexopoulos , david barton",sigmod record,1995
2304,unpacking the semantics of source and usage to perform semantic reconciliation in large-scale information systems,"ken smith , leo obrst",sigmod record,1999
2305,analysis of navigation behaviour in web sites integrating multiple information systems,"myra spiliopoulou , bettina berendt",vldb j.,2000
2308,approximate query processing using wavelets,"kyuseok shim , kaushik chakrabarti , minos n. garofalakis , rajeev rastogi",vldb,2000
2321,dictionary-based order-preserving string compression,gennady antoshenkov,vldb j.,1997
2324,an alternative storage organization for rolap aggregate views based on cubetrees,"yannis kotidis , nick roussopoulos",sigmod conference,1998
2327,"preservation of digital data with self-validating , self-instantiating knowledge-based archives","reagan moore , bertram ludäscher , richard marciano",sigmod record,2001
2336,e.piphany epicenter technology overview,sridhar ramaswamy,vldb,2000
2346,adaptive index structures,"yufei tao , dimitris papadias",vldb,2002
2357,a multi-similarity algebra,"v. s. subrahmanian , sibel adali , maria luisa sapino , piero a. bonatti",sigmod conference,1998
2359,report on ngits ' 99 : the 4th international workshop on next generation information technologies and systems,opher etzion,sigmod record,1999
2365,wave-indices : indexing evolving databases,"hector garcia-molina , narayanan shivakumar",sigmod conference,1997
2371,editorial,richard t. snodgrass,acm trans . database syst .,2001
2395,webdb ' 98 : international workshop on the web and databases,"alberto o. mendelzon , paolo atzeni",sigmod record,1998
2411,a database approach to quality of service specification in video databases,"mohand-said hacid , elisa bertino , ahmed k. elmagarmid",sigmod record,2003
2412,on optimal node splitting for r-trees,"yván j. garcía , scott t. leutenegger , mario a. lopez",vldb,1998
2414,hypergraph based reorderings of outer join queries with complex predicates,"gautam bhargava , balakrishna r. iyer , piyush goel",sigmod conference,1995
2418,picodbms : scaling down database techniques for the smartcard,"patrick valduriez , philippe pucheral , christophe bobineau , luc bouganim",vldb j.,2001
2423,efficient dynamic mining of constrained frequent sets,"laks v. s. lakshmanan , raymond t. ng , carson kai-sang leung",acm trans . database syst .,2003
2424,"agents , turst , and information access on the semantic web","timothy w. finin , anupam joshi",sigmod record,2002
2425,template-based wrappers in the tsimmis system,"joachim hammer , hector garcia-molina , svetlozar nestorov , ramana yerneni , markus m. breunig , vasilis vassalos",sigmod conference,1997
2427,journal relevance,richard t. snodgrass,sigmod record,2003
2439,a study on data point search for hg-trees,"paul h. lewis , joseph kuan",sigmod record,1999
2454,practical lessons in supporting large-scale computational science,"terence critchlow , ron musick",sigmod record,1999
2467,acdn : a content delivery network for applications,"michael rabinovich , pradnya karbhari , fred douglis , zhen xiao",sigmod conference,2002
2472,metrics for accessing heterogeneous data : is there any hope ? ( panel ),"michael stonebraker , nicholas j. belkin , gio wiederhold , erich j. neuhold , leonard j. seligman",vldb,1995
2516,contorting high dimensional data for efficient main memory processing,"beng chin ooi , bin cui , kian-lee tan , jianwen su",sigmod conference,2003
2532,optimizing queries on compressed bitmaps,"sihem amer-yahia , theodore johnson",vldb,2000
2541,"sqlj part 0 , now known as sql/olb ( object-language bindings )","andrew eisenberg , jim melton",sigmod record,1998
2544,"data morphing : an adaptive , cache-conscious storage technique","richard a. hankins , jignesh m. patel",vldb,2003
2564,memory requirements for query execution in highly constrained devices,"luc bouganim , nicolas anciaux , philippe pucheral",vldb,2003
2566,digital library services in mobile computing,"evaggelia pitoura , melliyal annamalai , bharat k. bhargava",sigmod record,1995
2580,emergent semantics and the multimedia semantic web,"william i. grosky , farshad fotouhi , d. v. sreenath",sigmod record,2002
2585,to table or not to table : a hypertabular answer,"giuseppe santucci , laura tarantino",sigmod record,1996
2595,a foundation for multi-dimensional databases,"laks v. s. lakshmanan , marc gyssens",vldb,1997
2601,reminiscences on influential papers,"kaladhar voruganti , renée j. miller , kenneth a. ross , flip korn",sigmod record,2002
2604,dynamic update cube for range-sum queries,"seok-ju chun , ju-hong lee , seok-lyong lee , chin-wan chung",vldb,2001
2614,chair 's message,richard t. snodgrass,sigmod record,2001
2615,indexing and querying xml data for regular path expressions,"bongki moon , quanzhong li",vldb,2001
