id,title,authors,venue,year
1270,exploiting early sorting and early partitioning for decision support query processing,"j. claussen , a. kemper , d. kossmann , c. wiesner",the vldb journal -- the international journal on very large data bases,2000
1291,self-similarity in the web,"stephen dill , ravi kumar , kevin s. mccurley , sridhar rajagopalan , d. sivakumar , andrew tomkins",very large data bases,2001
1295,the worlinfo assistant : spatio-temporal information integration on the web,"jos &#233; luis ambite , craig a. knoblock , mohammad r. kolahdouzan , maria muslea , cyrus shahabi , snehal thakkar",very large data bases,2001
1315,approximate string joins in a database ( almost ) for free,"luis gravano , panagiotis g. ipeirotis , h. v. jagadish , nick koudas , s. muthukrishnan , divesh srivastava",very large data bases,2001
1317,a taxonomy for secure object-oriented databases,"martin s. olivier , sebastiaan h. von solms",acm transactions on database systems ( tods ),1994
1321,hyperqueries : dynamic distributed query processing on the internet,"alfons kemper , christian wiesner",very large data bases,2001
1332,a formal perspective on the view selection problem,"rada chirkova , alon y. halevy , dan suciu",very large data bases,2001
1342,approximate query processing : taming the terabytes,"minos n. garofalakis , phillip b. gibbon",very large data bases,2001
1345,caching technologies for web applications,c. mohan,very large data bases,2001
1346,developing an indexing scheme for xml document collection using the oracle8i extensibility framework,"seema sundara , ying hu , timothy chorma , nipun agarwal , jagannathan srinivasan",very large data bases,2001
1349,a comparative study of alternative middle tier caching solutions to support dynamic web content acceleration,"anindya datta , kaushik dutta , helen m. thomas , debra e. vandermeer , krithi ramamritham , dan fishman",very large data bases,2001
1358,"biodiversity informatics : the challenge of rapid development , large databases , and complex data ( keynote )","meridith a. lane , james l. edwards , ebbe nielsen",very large data bases,2000
1379,"set containment joins : the good , the bad and the ugly","karthikeyan ramasamy , jignesh m. patel , jeffrey f. naughton , raghav kaushik",very large data bases,2000
1395,similarity search for adaptive ellipsoid queries using spatial transformation,"yasushi sakurai , masatoshi yoshikawa , ryoji kataoka , shunsuke uemura",very large data bases,2001
1399,caching strategies for data-intensive web sites,"khaled yagoub , daniela florescu , val &#233; rie issarny , patrick valduriez",very large data bases,2000
1410,a database index to large biological sequences,"ela hunt , malcolm p. atkinson , robert w. irving",very large data bases,2001
1417,cache portal : technology for accelerating database-driven e-commerce web sites,"wen-syan li , k. sel &#231; uk candan , wang-pin hsiung , oliver po , divyakant agrawal , qiong luo , wei-kuang waine huang , yusuf akca , cemal yilmaz",very large data bases,2001
1419,naos - efficient and modular reactive capabilities in an object-oriented database system,"christine collet , thierry coupaye , t. svensen",very large data bases,1994
1428,2q : a low overhead high performance buffer management replacement algorithm,"theodore johnson , dennis shasha",very large data bases,1994
1437,managing a db2 parallel edition database,gilles fecteau,very large data bases,1995
1446,value-cognizant speculative concurrency control,"azer bestavros , spyridon braoudakis",very large data bases,1995
1459,index concurrency control in firm real-time database systems,"brajesh goyal , jayant r. haritsa , s. seshadri , v. srinivasan",very large data bases,1995
1469,a practical and modular implementation of extended transaction models,"roger s. barga , calton pu",very large data bases,1995
1472,managing intra-operator parallelism in parallel database systems,"manish mehta , david j. dewitt",very large data bases,1995
1479,a cost model for clustered object-oriented databases,"georges gardarin , jean-robert gruser , zhao-hui tang",very large data bases,1995
1487,from nested-loop to join queries in oodb,"hennie j. steenhagen , peter m. g. apers , henk m. blanken , rolf a. de by",very large data bases,1994
1493,the data that you wo n't find in databases : tutorial panel on data exchange formats,"peter buneman , david maier",international conference on management of data,1995
1500,a database interface for file update,"serge abiteboul , sophie cluet , tova milo",international conference on management of data,1995
1510,dynamic resource brokering for multi-user query execution,"diane l. davison , goetz graefe",international conference on management of data,1995
1514,balancing histogram optimality and practicality for query result size estimation,"yannis e. ioannidis , viswanath poosala",international conference on management of data,1995
1523,shore : combining the best features of oodbms and file systems,corporate the shore team,international conference on management of data,1995
1527,visdb : a system for visualizing large databases,"daniel a. keim , hans-peter kriegel",international conference on management of data,1995
1532,tutorial on storage technology : raid and beyond,garth a. gibson,international conference on management of data,1995
1533,datamine-interactive rule discovery system,"t. imielinski , a. virmani",international conference on management of data,1995
1543,order-of-magnitude advantage on tpc-c through massive parallelism,charles levine,international conference on management of data,1995
1556,an execution model for limited ambiguity rules and its application to derived data update,"i.-min a. chen , richard hull , dennis mcleod",acm transactions on database systems ( tods ),1995
1567,a framework for providing consistent and recoverable agent-based access to heterogeneous mobile databases,"evaggelia pitoura , bharat bhargava",acm sigmod record,1995
1584,a general solution of the n-dimensional b-tree problem,michael freeston,international conference on management of data,1995
1588,the merge/purge problem for large databases,"mauricio a. hern &#225; ndez , salvatore j. stolfo",international conference on management of data,1995
1604,data and knowledge base research at hong kong university of science and technology,"p. drew , b. hamidzadeh , k. karlapalem , a. kean , d. lee , q. li , f. lochovsky , c. d. shum , b. wuthrich",acm sigmod record,1995
1607,"opportunities at arpa , nsf , and elsewhere",xiaolei qian,acm sigmod record,1995
1611,a research status report on adaptation for mobile data access,"brian d. noble , m. satyanarayanan",acm sigmod record,1995
1621,oracle 's symmetric replication technology and implications for application design,"dean daniels , lip boon doo , alan downing , curtis elsbernd , gary hallmark , sandeep jain , bob jenkins , peter lim , gordon smith , benny souder , jim stamos",international conference on management of data,1994
1625,nonstop sql : scalability and availability for decision support,susanne englert,international conference on management of data,1994
1640,sequence query processing,"praveen seshadri , miron livny , raghu ramakrishnan",international conference on management of data,1994
1645,quickstore : a high performance mapped object store,"seth j. white , david j. dewitt",international conference on management of data,1994
1669,relaxed transaction processing,"munindar p. singh , christine tomlinson , darrell woelk",international conference on management of data,1994
1671,the medusa project : autonomous data management in a shared-nothing parallel database machine,"g. m. bryan , w. e. moore , b. j. curry , k. w. lodge , j. geyer",international conference on management of data,1994
1690,medical information systems : characterization and challenges,"jorge c. g. ramirez , lon a. smith , lynn l. peterson",acm sigmod record,1994
1703,a consensus glossary of temporal database concepts,"curtis dyreson , fabio grandi , wolfgang k &#228; fer , nick kline , nikos lorentzos , yannis mitsopoulos , angelo montanari , daniel nonen , elisa peressi , barbara pernici , john f. roddick , nandlal l. sarda , maria rita scalas , arie segev , richard thomas snodgrass , mike d. soo , abdullah tansel , paolo tiberio , gio wiederhold",acm sigmod record,1994
1704,the database research group at eth zurich,"moira c. norrie , stephen m. blott , hans-j &#246; rg schek , gerhard weikum",acm sigmod record,1994
1719,optimization of dynamic query evaluation plans,"richard l. cole , goetz graefe",international conference on management of data,1994
1721,estimating page fetches for index scans with finite lru buffers,"arun swami , k. bernhard schiefer",international conference on management of data,1994
1727,quickly generating billion-record synthetic databases,"jim gray , prakash sundaresan , susanne englert , ken baclawski , peter j. weinberger",international conference on management of data,1994
1734,loading databases using dataflow parallelism,"tom barclay , robert barnes , jim gray , prakash sundaresan",acm sigmod record,1994
1735,recent design trade-offs in sql3,"nelson mattos , linda g. demichiel",acm sigmod record,1994
1749,integrating dynamically-fetched external information into a dbms for semistructured data,"jason mchugh , jennifer widom",acm sigmod record,1997
1759,report on dart ' 96 : databases : active and real-time ( concepts meet practice ),"krithi ramamritham , nandit soparkar",acm sigmod record,1997
1763,intelligent access to heterogeneous information sources : report on the 4th workshop on knowledge representation meets databases,"franz baader , manfred a. jeusfeld , werner nutt",acm sigmod record,1997
1768,materialized views and data warehouses,nick roussopoulos,acm sigmod record,1998
1776,your mediators need data conversion !,"sophie cluet , claude delobel , j &#233; r &#466; me sim &#233; on , katarzyna smaga",international conference on management of data,1998
1786,changing the rules : transformations for rule-based optimizers,"mitch cherniack , stan zdonik",international conference on management of data,1998
1792,bitmap index design and evaluation,"chee-yong chan , yannis e. ioannidis",international conference on management of data,1998
1793,autoadmin what-if index analysis utility,"surajit chaudhuri , vivek narasayya",international conference on management of data,1998
1814,devise : integrated querying and visual exploration of large datasets,"m. livny , r. ramakrishnan , k. beyer , g. chen , d. donjerkovic , s. lawande , j. myllymaki , k. wenger",international conference on management of data,1997
1824,supporting multiple view maintenance policies,"latha s. colby , akira kawaguchi , daniel f. lieuwen , inderpal singh mumick , kenneth a. ross",international conference on management of data,1997
1831,revisiting commit processing in distributed database systems,"ramesh gupta , jayant haritsa , krithi ramamritham",international conference on management of data,1997
1845,the infosleuth project,"r. j. bayardo , jr. , w. bohrer , r. brice , a. cichocki , j. fowler , a. halal , v. kashyap , t. ksiezyk , g. martin , m. nodine , m. rashid , m. rusinkiewicz , r. shea , c. unnikrishnan , a. unruh , d. woelk",international conference on management of data,1997
1866,strudel : a web site management system,"mary fernandez , daniela florescu , jaewoo kang , alon levy , dan suciu",international conference on management of data,1997
1868,sentinel : an object-oriented dbms with event-based rules,s. chakravarthy,international conference on management of data,1997
1879,control strategies for complex relational query processing in shared nothing systems,"lionel brunie , harald kosch",acm sigmod record,1996
1885,unisql 's next-generation object-relational database management system,"albert d'andrea , phil janus",acm sigmod record,1996
1888,dynamic information visualization,yannis e. ioannidis,acm sigmod record,1996
1889,information visualization,"tiziana catarci , isabel f. cruz",acm sigmod record,1996
1890,spotfire : an information exploration environment,christopher ahlberg,acm sigmod record,1996
1892,"a response to r. camps ' article domains , relations and religious wars",c. j. date,acm sigmod record,1996
1899,an orthogonally persistent java,"m. p. atkinson , l. dayn &#232; s , m. j. jordan , t. printezis , s. spence",acm sigmod record,1996
1921,fast parallel similarity search in multimedia databases,"stefan berchtold , christian b &#246; hm , bernhard braunm &#252; ller , daniel a. keim , hans-peter kriegel",international conference on management of data,1997
1929,maintenance of data cubes and summary tables in a warehouse,"inderpal singh mumick , dallan quass , barinderpal singh mumick",international conference on management of data,1997
1932,concurrency and recovery in generalized search trees,"marcel kornacker , c. mohan , joseph m. hellerstein",international conference on management of data,1997
1940,modularization techniques for active rules design,"elena baralis , stefano ceri , stefano paraboschi",acm transactions on database systems ( tods ),1996
1951,mining quantitative association rules in large relational tables,"ramakrishnan srikant , rakesh agrawal",international conference on management of data,1996
1956,a teradata content-based multimedia object manager for massively parallel architectures,"w. o'connell , i. t. ieong , d. schrader , c. watson , g. au , a. biliris , s. choo , p. colin , g. linderman , e. panagos , j. wang , t. walter",international conference on management of data,1996
1959,fault-tolerant architectures for continuous media servers,"banu &#214; zden , rajeev rastogi , prashant shenoy , avi silberschatz",international conference on management of data,1996
1964,data access for the masses through ole db,jos &#233; a. blakeley,international conference on management of data,1996
1966,hot mirroring : a method of hiding parity update penalty and degradation during rebuilds for raid5,"kazuhiko mogi , masaru kitsuregawa",international conference on management of data,1996
1981,multi-dimensional resource scheduling for parallel queries,"minos n. garofalakis , yannis e. ioannidis",international conference on management of data,1996
1985,rule languages and internal algebras for rule-based optimizers,"mitch cherniack , stanley b. zdonik",international conference on management of data,1996
1994,a framework for supporting data integration using the materialized and virtual approaches,"richard hull , gang zhou",international conference on management of data,1996
1997,"domains , relations and religious wars",r. camps,acm sigmod record,1996
1998,accessing relational databases from the world wide web,"tam nguyen , v. srinivasan",international conference on management of data,1996
1999,is gui programming a database research problem ?,"nita goyal , charles hoch , ravi krishnamurthy , brian meckler , michael suckow",international conference on management of data,1996
2015,transparent mid-tier database caching in sql server,"per - &#197; ke larson , jonathan goldstein , jingren zhou",international conference on management of data,2003
2033,robust and efficient fuzzy match for online data cleaning,"surajit chaudhuri , kris ganjam , venkatesh ganti , rajeev motwani",international conference on management of data,2003
2034,efficient similarity search and classification via rank aggregation,"ronald fagin , ravi kumar , d. sivakumar",international conference on management of data,2003
2047,extracting structured data from web pages,"arvind arasu , hector garcia-molina , stanford university",international conference on management of data,2003
2063,dynamic sample selection for approximate query processing,"brian babcock , surajit chaudhuri , gautam das",international conference on management of data,2003
2069,standards,andrew eisenberg,acm sigmod record,2003
2086,xpress : a queriable compression for xml data,"jun-ki min , myung-jae park , chin-wan chung",international conference on management of data,2003
2099,integrating and customizing heterogeneous e-commerce applications,"anat eyal , tova milo",the vldb journal -- the international journal on very large data bases,2001
2108,monotonic complements for independent data warehouses,"d. laurent , j. lechtenb &#246; rger , n. spyratos , g. vossen",the vldb journal -- the international journal on very large data bases,2001
2109,answering queries using views : a survey,alon y. halevy,the vldb journal -- the international journal on very large data bases,2001
2112,new partnership with acm and update on the journal,m. tamer &#214; zsu,the vldb journal -- the international journal on very large data bases,2003
2116,business-to-business interactions : issues and enabling technologies,"b. medjahed , b. benatallah , a. bouguettaya , a. h. h. ngu , a. k. elmagarmid",the vldb journal -- the international journal on very large data bases,2003
2120,an approach to confidence based page ranking for user oriented web search,"debajyoti mukhopadhyay , debasis giri , sanasam ranbir singh",acm sigmod record,2003
2121,modelling temporal thematic map contents,"alberto d'onofrio , elaheh pourabbas",acm sigmod record,2003
2127,towards a database body of knowledge : a study from spain,"coral calero , mario piattini , francisco ruiz",acm sigmod record,2003
2139,"ordering information , conference organizers , program committees , additional reviewers , additional demonstrations reviewers , sponsors , vldb endowment , preface , foreword",,very large data bases,2000
2141,microsoft english query 7.5 : automatic extraction of semantics from relational databases and olap cubes,adam blum,very large data bases,1999
2172,effective page refresh policies for web crawlers,"junghoo cho , hector garcia-molina",acm transactions on database systems ( tods ),2003
2179,actiview : adaptive data presentation using supersql,"yoko maeda , motomichi toyama",very large data bases,2001
2182,incremental computation and maintenance of temporal aggregates,"jun yang , jennifer widom",the vldb journal -- the international journal on very large data bases,2003
2190,thesus : organizing web document collections based on link semantics,"maria halkidi , benjamin nguyen , iraklis varlamis , michalis vazirgiannis",the vldb journal -- the international journal on very large data bases,2003
2196,analysis of predictive spatio-temporal queries,"yufei tao , jimeng sun , dimitris papadias",acm transactions on database systems ( tods ),2003
2216,"the sensor spectrum : technology , trends , and requirements","joseph m. hellerstein , wei hong , samuel r. madden",acm sigmod record,2003
2223,maximizing buffer and disk utilizations for news on-demand,"raymond t. ng , jinhai yang",very large data bases,1994
2231,data integration in the large : the challenge of reuse,"arnon rosenthal , leonard j. seligman",very large data bases,1994
2236,peer-to-peer research at stanford,"mayank bawa , brian f. cooper , arturo crespo , neil daswani , prasanna ganesan , hector garcia-molina , sepandar kamvar , sergio marti , mario schlosser , qi sun , patrick vinograd , beverly yang",acm sigmod record,2003
2237,database graph views : a practical model to manage persistent graphs,"alejandro guti &#233; rrez , philippe pucheral , hermann steffen , jean-marc th &#233; venin",very large data bases,1994
2238,the hyperion project : from data integration to data coordination,"marcelo arenas , vasiliki kantere , anastasios kementsietsidis , iluju kiringa , ren &#233; e j. miller , john mylopoulos",acm sigmod record,2003
2244,the piazza peer data management project,"igor tatarinov , zachary ives , jayant madhavan , alon halevy , dan suciu , nilesh dalvi , xin ( luna ) dong , yana kadiyska , gerome miklau , peter mork",acm sigmod record,2003
2247,investigation of algebraic query optimisation techniques for database programming languages,"alexandra poulovassilis , carol small",very large data bases,1994
2257,rp * : a family of order preserving scalable distributed data structures,"witold litwin , marie-anne neimat , donovan a. schneider",very large data bases,1994
2262,fast and accurate text classification via multiple linear discriminant projections,"soumen chakrabarti , shourya roy , mahesh v. soundalgekar",the vldb journal -- the international journal on very large data bases,2003
2282,selective information dissemination in p2p networks : problems and solutions,"manolis koubarakis , christos tryfonopoulos , stratos idreos , yannis drougas",acm sigmod record,2003
2283,a low-cost storage server for movie on demand databases,"banu &#214; zden , alexandros biliris , rajeev rastogi , abraham silberschatz",very large data bases,1994
2292,"review of the data warehouse toolkit : the complete guide to dimensional modeling ( 2nd edition ) by ralph kimball , margy ross . john wiley & sons , inc. 2002 .",alexander a. anisimov,acm sigmod record,2003
