id,title,authors,venue,year
2128,incremental maintenance for non-distributive aggregate functions,"t palpanas , r sidle , r cochrane , h pirahesh",vldb,2002
2131,dtd-directed publishing with attribute translation grammars,"m benedikt , c chan , w fan , r rastogi , s zheng , a zhou",vldb,2002
2158,the rubicon of smart data,r king,vldb,2002
2185,grid data management systems & services,,,2003
2193,querying and mining data streams : you only get one look,,,2002
2195,automation in information extraction and data integration,,,2002
2207,optimizing view queries in rolex to support navigable result trees,"p bohannon , s ganguly , h korth , p narayan , p shenoy",vldb,2002
2209,hippocratic databases,"r agrawal , j kiernan , r srikant , y xu",vldb,2002
2248,static analysis techniques for predicting the behavior of active database rules,"a aiken , j hellerstein , j widom",acm trans . database syst .,1995
2255,fast algorithms for universal quantification in large databases,"g graefe , r cole",acm trans . database syst .,1995
2263,a structured approach for the definition of the semantics of active databases,"p fraternali , l tanca",acm trans . database syst .,1995
2291,poesia : an ontological workflow approach for composing web services in agriculture,"r fileto , l liu , c pu , e assad , c medeiros",vldb j.,2003
2293,learning to match ontologies on the semantic web,"a doan , j madhavan , r dhamankar , p domingos , a halevy",vldb j.,2003
2317,a foundation for representing and quering moving objects,"r gќting , m bіhlen , m erwig , c jensen , n lorentzos , m schneider , m vazirgiannis",acm trans . database syst .,2000
2323,optimizing object queries using an effective calculus,"l fegaras , d maier",acm trans . database syst .,2000
2338,a logical foundation for deductive object-oriented databases,"m liu , g dobbie , t ling",acm trans . database syst .,2002
2342,editorial,,,2001
2355,optimization techniques for queries with expensive methods,j hellerstein,acm trans . database syst .,1998
2357,database design with common sense business reasoning and learning,"v storey , r chiang , d dey , r goldstein , s sundaresan",acm trans . database syst .,1997
2359,safe query languages for constraint databases,p revesz,acm trans . database syst .,1998
2360,information gathering in the world-wide web : the w3ql query language and the w3qs system,"d konopnicki , o shmueli",acm trans . database syst .,1998
2371,an ontological analysis of the relationship construct in conceptual modeling,"y wand , v storey , r weber",acm trans . database syst .,1999
2382,efficient support for interactive service in multi-resolution vod systems,"k law , j lui , l golubchik",vldb j.,1999
2387,spatial and temporal content-based access to hypervideo databases,"h jiang , a elmagarmid",vldb j.,1998
2388,opt + + : an object-oriented implementation for extensible database query optimization,"n kabra , d dewitt",vldb j.,1999
2409,synchronization and recovery in a client-server storage system,"e panagos , a biliris",vldb j.,1997
2418,parametric query optimization,"y ioannidis , r ng , k shim , t sellis",vldb j.,1997
2421,graphical interaction with heterogeneous databases,"t catarci , g santucci , j cardiff",vldb j.,1997
2424,a logical view of structured files,"s abiteboul , s cluet , t milo",vldb j.,1998
2434,"optimizing relational queries in connection hypergraphs : nested queries , views , and binding propagations",j han,vldb j.,1998
2438,maintenance of implication integrity constraints under updates to constraints,"n ishakbeyoglu , z жzsoyoglu",vldb j.,1998
2439,"advanced data processing in krisys : modeling concepts , implementation techniques , and client/server issues","s deпloch , t hфrder , n mattos , b mitschang , j thomas",vldb j.,1998
2464,efficient filtering of xml documents with xpath expressions,"c chan , p felber , m garofalakis , r rastogi",vldb j.,2002
2478,supporting efficient multimedia database exploration,"w li , k candan , k hirata , y hara",vldb j.,2001
2481,one-dimensional and multi-dimensional substring selectivity estimation,"h jagadish , o kapitskaia , r ng , d srivastava",vldb j.,2000
2484,dynamic vp-tree indexing for n-nearest neighbor search given pair-wise distances,"a fu , p chan , y cheung , y moon",vldb j.,2000
2489,efficiently publishing relational data as xml documents,"j shanmugasundaram , e shekita , r barr , m carey , b lindsay , h pirahesh , b reinwald",vldb j.,2001
2501,integrating and customizing heterogeneous e-commerce applications,"a eyal , t milo",vldb j.,2001
2514,"the hb-pi-tree : a multi-attribute index supporting concurrency , recovery and node consolidation","g evangelidis , d lomet , b salzberg",vldb j.,1997
2515,data placement in shared-nothing parallel database systems,"m mehta , d dewitt",vldb j.,1997
2522,quickstore : a high performance mapped object store,"s white , d dewitt",vldb j.,1995
2530,parallelising oodbms traversals : a performance evaluation,"d dewitt , j naughton , j shafer , s venkataraman",vldb j.,1996
2537,the software information base : a server for reuse,"p constantopoulos , m jarke , j mylopoulos , y vassiliou",vldb j.,1995
2550,"title , announcement",,,1995
2555,chronological scheduling of transactions with temporal dependencies,"d georgakopoulos , m rusinkiewicz , w litwin",vldb j.,1994
2596,using referential integrity to easily define consistent subset replicas,b hammond,vldb,1996
2597,amicalola report : database and information system research challenges and opportunities in semantic web and enterprises,"a sheth , r meersman",sigmod record,2002
2602,intra-transaction parallelism in the mapping of an object model to a relational multi-processor system,"m rys , m norrie , h schek",vldb,1996
2614,sprint : a scalable parallel classifier for data mining,"j shafer , r agrawal , m mehta",vldb,1996
